{"sessionId":"review-1","evidenceBundleRef":{"artifactId":"evidence-1","artifactType":"PREVIEW_EVIDENCE_BUNDLE","schemaVersion":"1.0","contentHash":"aaaaaaaaaaaaaaaaaaaaaaaaaaaaaaaaaaaaaaaaaaaaaaaaaaaaaaaaaaaaaaaa","sourceRevision":"r1"},"reviewerRoles":["APPROVER"],"comments":[],"requestedChanges":[],"approvalDecision":"PENDING","visibility":"PRIVATE","expiresAt":"2026-08-24T00:00:00Z","auditTrail":[]}
